asin,title,brand,category,popularity_rank,rating_count,average_rating,price,overall_sentiment,positive_feedback_ratio,key_positive_features,common_complaints,best_fit_segments,poor_fit_segments,review_volume_category,feature_count
B07ZPC9QD4,Apple AirPods Pro,Apple,headphones,1,300544,4.8,249.0,overwhelmingly positive,very high,"Active noise cancellation for immersive sound | Transparency mode for hearing and connecting with the world around you | Three sizes of soft, tapered silicone tips for a customizable fit | Sweat and water resistant",minor complaints about fit or durability,commuters and frequent travelers | athletes and gym-goers | wireless convenience seekers,no major segment mismatches reported,bestseller,8
B01M0GB8CC,"Apple EarPods Headphones with Lightning Connector. Microphone with Built-in Remote to Control Music, Phone Calls, and Volume. Wired Earbuds for iPhone",Apple,headphones,2,201075,4.6,16.99,overwhelmingly positive,very high,"Unlike traditional, circular earbuds, the design of the EarPods is defined by the geometry of the ear. Which makes them more comfortable for more people than any other earbud-style headphones. | The speakers inside the EarPods have been engineered to maximize sound output and minimize sound loss, which means you get high-quality audio. | The EarPods with Lightning Connector also include a built-in remote that lets you adjust the volume, control the playback of music and video, and answer or end calls with a pinch of the cord. | Works with all devices that have a Lightning connector and support iOS 10 or later, including iPod touch, iPad, and iPhone. Also works with iPad models with iPadOS.",minor complaints about fit or durability,budget-conscious buyers,wired-only; not ideal for users wanting wireless freedom | may lack durability or advanced features for demanding users,bestseller,4
B07S764D9V,"Panasonic ErgoFit Wired Earbuds, In-Ear Headphones with Microphone and Call Controller, Ergonomic Custom-Fit Earpieces (S/M/L), 3.5mm Jack for Phones and Laptops - RP-TCM125-A (Blue)",Panasonic,headphones,3,136251,4.3,13.99,generally positive,high,"The RP-TCM125 ErgoFit Earbud Headphones with Microphone and Call Controller are the perfect combination of style, comfort, functionality and most of all, high-quality sound. The In-line microphone on the cord of earbud headphones is used for answering calls or voice commands. Three sets of earpads (S/M/L included) | Product Note : If the size of the earbud tips does not match the size of your ear canals or the headset is not worn properly in your ears, you may not obtain the correct sound qualities or call performance. Change the earbud tips to ones that fit more snugly in your ears",some complaints about build quality or value for money,commuters and frequent travelers | budget-conscious buyers,wired-only; not ideal for users wanting wireless freedom | may lack durability or advanced features for demanding users,bestseller,2
B09XRCVYGC,"OnePlus Bullets Wireless Z2 Bluetooth 5.0 in Ear Earphones, Bombastic Bass – 12.4 mm Drivers, 30 Hrs Battery Life (Magico Black)",ONEPLUS,headphones,4,121313,4.2,52.0,generally positive,high,"A quick 10-minute charge delivers up to 20 hours of immersive audio playback. | The flagship-level battery life delivers up to 30 hours of non-stop music on a single charge. | A large 12.4 mm bass driver delivers uncompromisingly deep bass for powerful beats. Experience incredibly rich audio detail at every frequency with the titanium coating dome | Anti-distortion audio technology ensures your audio playtime stays silky-smooth. Thanks to the larger sound cavity and industry-leading algorithms, notes remain distortion-free",some complaints about build quality or value for money,commuters and frequent travelers | athletes and gym-goers | wireless convenience seekers,no major segment mismatches reported,bestseller,5
B08TMJFSV3,"Soundcore Anker Life P2 True Wireless Earbuds, Clear Sound, USB C, 40H Playtime, IPX7 Waterproof, Wireless Earphones for Work, Home Office",Soundcore,headphones,5,117047,4.2,39.99,generally positive,high,"Incredible Sound Loved by 20 Million+ People | Perfect for Home Offices: Each earbud has two microphones with beamforming noise reduction as well as cVc 8.0 technology for superior vocal enhancement and background-noise suppression. | Incredible Sound Powered By Graphene Drivers: Delivers music with a wider soundstage and exceptional accuracy and clarity. BassUp technology enhances bass by up to 43% and aptX audio offers lossless transmission between your device and the wireless earbuds. | 40-Hour Playtime* with Fast Charge: A single charge gives you a full 7 hours of listening, while the charging case extends that to 40 hours. When you’re in a rush and need power fast, simply charge for 10 minutes and get up to 1 hour of playtime.",some complaints about build quality or value for money,commuters and frequent travelers | athletes and gym-goers | wireless convenience seekers,no major segment mismatches reported,bestseller,5
B00PKTU83U,"Sony ZX Series Wired On-Ear Headphones with Mic, White MDR-ZX110AP",Sony,headphones,6,104579,4.5,18.25,overwhelmingly positive,very high,"Lightweight 1.38 in neodymium dynamic drivers deliver a punchy, rhythmic response to even the most demanding tracks | The swiveling earcup design allows easy storage when you’re not using them, and enhances portability when you’re traveling | With an inline remote and built-in microphone on the headphone cord, take hands-free calls from selected smartphones while listening to music | Cushioned earpads for total comfort and enfolding closed-back design seals in sound",minor complaints about fit or durability,commuters and frequent travelers | budget-conscious buyers,wired-only; not ideal for users wanting wireless freedom | may lack durability or advanced features for demanding users,mainstream,6
B08K2S5B88,"ZIHNIC Bluetooth Headphones Over-Ear, Foldable Wireless and Wired Stereo Headset Micro SD/TF, FM for Cell Phone,PC,Soft Earmuffs &Light Weight for Prolonged Wearing(Black/Green)",ZIHNIC,headphones,7,73753,4.4,27.99,generally positive,high,"【ASTONISHING SOUND PRODUCTION 】: High Definition Stereo Headphones, specially developed software and noise reduction technology designed to prevent you from heating ambient noises and makes you focus on what you want to hear. Lose yourself in immersive music even in the lowest volume levels! The goal that provide customers with outstanding sound quality is our constant pursuit | 【BUILT FOR YOUR COMFORTABILITY 】: The earmuff is made by artificial leather, ensuring lasting comfort. They are foldable and stretchable, which allows you to find the perfect fit without constraint and excellent durability. Zihnic is the best choice for travel, sport and daily use by Unisex Kids, Teens and Adults. | 【SEAMLESS BLUETOOTH CONNECTION】: Built to provide a quick and stable Bluetooth connection . Just slide the on/off button and the headphones will be in ready to pair mode. The Wireless Headphones are compatible with all Bluetooth or 3.5mm plug cable enabled devices! You can also receive calls and have hands-free communication through the special noise reduction technology microphone Zihnic Headphones are compatible with all Phones X, 8 Plus, Samsung S9, S8, Pads, Pods, Huawei, Nexus, Amazon Alex | 【ERGONOMIC DESIGN】 : Zihnic headphones are built from materials that are extremely nice to touch which provides the model premium outlook. The super soft memory-protein foam leather earmuffs and headbands contribute to maximum comfort regardless of how long you use them. Zihnic headphones also come with a protective Premium Case - a great way to reduce wear and tear.",some complaints about build quality or value for money,athletes and gym-goers | wireless convenience seekers | home listeners and office workers,wired-only; not ideal for users wanting wireless freedom,mainstream,5
B0C337TNGS,"Beats Powerbeats Pro Wireless Earbuds - Apple H1 Headphone Chip, Class 1 Bluetooth Headphones, 9 Hours of Listening Time, Sweat Resistant, Built-in Microphone - Ivory",Beats,headphones,8,70897,4.5,199.95,overwhelmingly positive,very high,"Totally wireless high-performance earphones | Up to 9 hours of listening time (more than 24 hours with charging case) | Adjustable, secure-fit earhooks for lightweight comfort and stability | Reinforced design for sweat & water resistance during tough workouts",minor complaints about fit or durability,commuters and frequent travelers | athletes and gym-goers | wireless convenience seekers,no major segment mismatches reported,mainstream,10
B0C337RV7Q,"Beats Solo3 Wireless On-Ear Headphones - Apple W1 Headphone Chip, Class 1 Bluetooth, 40 Hours of Listening Time, Built-in Microphone - Red (Latest Model)",Beats,headphones,9,67998,4.7,129.0,overwhelmingly positive,very high,"High-performance wireless Bluetooth headphones | Features the Apple W1 chip and Class 1 wireless Bluetooth connectivity | With up to 40 hours of battery life, Beats Solo3 wireless is your perfect everyday headphone | Compatible with iOS and Android devices",minor complaints about fit or durability,commuters and frequent travelers | wireless convenience seekers | premium audio enthusiasts,no major segment mismatches reported,mainstream,10
B0C338S8M7,"Beats Studio Buds – True Wireless Noise Cancelling Earbuds – Compatible with Apple & Android, Built-in Microphone, IPX4 Rating, Sweat Resistant Earphones, Class 1 Bluetooth Headphones - Moon Gray",Beats,headphones,10,67037,4.4,149.95,generally positive,high,"Custom acoustic platform delivers powerful, balanced sound | Control your sound with two distinct listening modes: Active Noise Cancelling (ANC) and Transparency mode | Three soft ear tip sizes for a stable and comfortable fit while ensuring an optimum acoustic seal | Up to 8 hours of listening time (up to 24 hours combined with pocket-sized charging case)",some complaints about build quality or value for money,commuters and frequent travelers | athletes and gym-goers | audiophiles and music professionals,no major segment mismatches reported,mainstream,9
B0BHWYQ47Y,"kurdene Bluetooth Wireless Earbuds, S8 Deep Bass Sound 38H Playtime IPX8 Waterproof Earphones Call Clear with Microphone in-Ear Bluetooth Headphones Comfortable for iPhone, Android",Kurdene,headphones,11,63672,4.3,20.99,generally positive,high,"【Latest Bluetooth 5.2 & Effortless Pairing】Kurdene wireless earbuds with advanced bluetooth 5.2 technology owns fast and stable transmission without tangling, which makes the Bluetooth earbuds connect to electronic devices more consistently, providing you with an uninterrupted calling and music experience and Noise cancellation.These bluetooth earphones would instant paired once taken out from the charging case and auto connects with the last-paired device. | 【Immersive Stereo Sound with long Lasting Barttery Life】Adapting powerful 8mm Neodymium magnet, kurdene S8 bluetooth earbuds provides pure balanced audio and clarity output for all music genres with loud sound, rich bass, clear midrange, balanced treble and high definition. A single charge gives you a full 6 hours of listening, while the charging case extends that to 38 hours. Enjoy your earbuds the entire day, without missing a beat. | 【Customizable Fit for Comfortable Wearing】Every surface that touches your ear is made of liquid Silicone-not hard plastic(M size is installed, 6 pairs of different shapes of Ear Caps with size S/ M/ L for option for a customizable fit). The liquid silicone nozzle spreads pressure evenly across your ear for comfort, stability, and passive noise blocking. Giving you a fit for all-day comfort with less fatigue | 【IPX8 Waterproof & Sweatproof】With an IPX8 rating, this wireless earbuds are resistant to sweat, water and rain. S8 wireless earbuds can endure and work flawlessly under different weather conditions. There’s nothing holding you back from running through the storm or sweating out your new personal best in the gym.(Please note: The charging case is not waterproof)",some complaints about build quality or value for money,commuters and frequent travelers | athletes and gym-goers | wireless convenience seekers,may lack durability or advanced features for demanding users,mainstream,5
B08PFW1S1V,"Soundcore Anker Life Q20 Hybrid Active Noise Cancelling Headphones, Wireless Over Ear Bluetooth Headphones, 40H Playtime, Hi-Res Audio, Deep Bass, Memory Foam Ear Cups, for Travel, Home Office",Soundcore,headphones,12,63247,4.5,65.99,overwhelmingly positive,very high,"Incredible Sound Loved by 20 Million+ People | Hi-Res Audio Certified: Custom oversized 40 mm dynamic drivers produce Hi-Res Audio—a certification only awarded to audio devices capable of producing exceptional sound. Life Q20 active noise canceling headphones reproduce your music with extended high frequencies that reach up to 40 kHz for extraordinary clarity and detail. | Reduce Ambient Noises By Up to 90%: Our team of engineers conducted more than 100,000 tests in real-life scenarios to fine-tune Life Q20’s 4 built-in ANC microphones and digital active noise cancellation algorithm. As a result, the hybrid active noise cancellation can detect and cancel out a wider range of low and mid-frequency noises such as cars and airplane engines. | 100% Stronger Bass: Our exclusive BassUp technology conducts real-time analysis of the low frequencies to instantly strengthen the bass output. Double press the play button when listening to bass-heavy genres like EDM and hip-hop for an amplified listening experience.",minor complaints about fit or durability,commuters and frequent travelers | wireless convenience seekers | home listeners and office workers,no major segment mismatches reported,mainstream,5
B00D75AB6I,Sennheiser Cx 180 Street Ii in-Ear Headphone Black,Sennheiser,headphones,13,62456,4.2,19.99,generally positive,high,"Innovative finger-contoured housing design enables for easy adjustment and optimal wearing comfort | Powerful, bass-driven stereo sound | Good attenuation of ambient noise | Optimised for mp3, iPod, iPhone, CD players and portable gaming systems",some complaints about build quality or value for money,gamers | audiophiles and music professionals | budget-conscious buyers,wired-only; not ideal for users wanting wireless freedom | may lack durability or advanced features for demanding users,mainstream,5
B09KQC7Z4S,"Bose QuietComfort 35 II Wireless Bluetooth Headphones, Noise-Cancelling, with Alexa Voice Control - Black",Bose,headphones,14,62404,4.7,344.78,overwhelmingly positive,very high,"Three levels of world-class noise cancellation for better listening experience in any environment | Alexa-enabled for voice access to music, information, and more | Noise-rejecting dual-microphone system for clear sound and voice pick-up | Balanced audio performance at any volume",minor complaints about fit or durability,commuters and frequent travelers | wireless convenience seekers | premium audio enthusiasts,no major segment mismatches reported,mainstream,7
B091K4WYD1,"OneOdio Over Ear Headphone, Wired Bass Headsets with 50mm Driver, Foldable Lightweight Headphones with Shareport and Mic for Recording Monitoring Podcast Guitar PC TV - (Red)",OneOdio,headphones,15,60653,4.5,32.99,overwhelmingly positive,very high,"BASS SOUND: Enjoy powerful bass and comfort with the OneOdio Studio headphones. Large 50-millimeter speaker unit drivers combined with neodymium magnets deliver dynamic bass, great for DJing, mixing, monitoring, or listening to music. | BUILT TO STAY COMFORTABLE: The soft padded ear cushions are designed for monitor headphones' comfort and noise isolation. The headband is adjustable and stretchable for you to find the desired angle you like to fit in. | NO MORE ADAPTER: A long DJ-style 9.8-foot cord easily reaches from the TV or stereo to your chair. A standard-sized 6.35mm plug and a 3.5mm plug are included. They both are completely detachable, you can plug in the mixer you want to use. | SINGLE-SIDE MONITORING: 90° swiveling ear cups for single-ear monitoring anytime; self-adjustable and flexible headband delivers a fatigue-free listening experience that can last for hours, ideal for mastering and mixing.",minor complaints about fit or durability,audiophiles and music professionals | home listeners and office workers,wired-only; not ideal for users wanting wireless freedom,mainstream,5
B078S34QZD,Sony Mdr Xb-450 Extra Bass Foldable Headphones Black,Sony,headphones,16,54454,4.0,29.99,generally positive,high,basic functionality,some complaints about build quality or value for money,general consumers,wired-only; not ideal for users wanting wireless freedom,niche,0
B0BS1615YC,"Logitech H390 Wired Headset for PC/Laptop, Stereo Headphones with Noise Cancelling Microphone, USB, In-Line Controls, Works with Chromebook - Black",Logitech,headphones,17,51445,4.4,21.88,generally positive,high,"Optimum Comfort: PC headphones with plush, padded headband and earcups | Enhanced Audio: Experience premium sound quality. System requirements: Windows Vista, Windows 7, Windows 8, Windows 10 or later, Chrome OS or  MAC OS X (10.2.8 or later), with USB-A port | Noise-Cancelling Qualities: A rotating microphone that minimizes background noise for clear calls, Frequency response (Headset): 20 Hz - 20 KHz | Advanced digital USB: Laser-tuned drivers provide enhanced digital audio. This plug-and-play headset can be used with any PC or Mac computer with a USB-A port or adapter without any software installation",some complaints about build quality or value for money,commuters and frequent travelers | gamers | budget-conscious buyers,wired-only; not ideal for users wanting wireless freedom | may lack durability or advanced features for demanding users,niche,9
B08DBDSVBC,"Sony WH-1000XM4 Wireless Premium Noise Canceling Overhead Headphones with Mic for Phone-Call and Alexa Voice Control, Midnight Blue WH1000XM4",Sony,headphones,18,49487,4.7,348.0,overwhelmingly positive,very high,"Industry-leading noise canceling with Dual Noise Sensor technology | Next-level music with Edge-AI, co-developed with Sony Music Studios Tokyo | Up to 30-hour battery life with quick charging (10 min charge for 5 hours of playback) | the WH1000XM4 Touch Sensor controls to pause play skip tracks, control volume, activate your voice assistant, and answer phone calls.",minor complaints about fit or durability,commuters and frequent travelers | audiophiles and music professionals | wireless convenience seekers,no major segment mismatches reported,niche,10
B07CYZGQ12,"PowerLocus Bluetooth Over-Ear Headphones, Wireless Stereo Foldable Headphones Wireless and Wired Headsets with Built-in Mic, Micro SD/TF, FM for iPhone/Samsung/iPad/PC (Purple)",PowerLocus,headphones,19,47958,4.4,26.99,generally positive,high,"AMAZING SOUND QUALITY: High Definition Stereo Headphones, specially developed software and noise reduction technology that aims to deliver the music from your iPod on a whole new level! Deep Bass in combination with Dynamic Power Sound, results in Superior Audio Quality, even in the highest volume levels! | GREAT COMFORT FOR ALL AGES: The over-ear headphones are foldable and stretchable, so they can fit perfectly almost any size head. PowerLocus are always are ready to impress with elegance and convenience, bringing more joy during the everyday use! PowerLocus is #1 Choice for Travel, Sport and Every day use by Unisex Kids, Teens and Adults. | CONNECT QUICKLY via Bluetooth 5.0: We made the bluetooth over ear headphones super easy to use. Just slide the on/off button and the headphones will be in ready to pair mode. The Wireless Headphones are compatible with all Bluetooth or 3.5mm plug cable enabled devices! You can also receive calls and have hands-free communication through the special noise reduction technology microphone. Compatible with all iPhone X, 8 Plus, Samsung S9, S8, iPad, iPod, Huawei, Nexus, Amazon Fire Tablet | QUALITY MADE DESIGN: PowerLocus is built from materials which are extremely nice to touch and provides the model premium outlook. The super soft memory-protein foam leather earmuffs and headband will contribute to optimum comfort even if you wear them for long time. Use them everywhere, together with the Protective Premium Case – great way to carry them without having scratches on them for long term.",some complaints about build quality or value for money,commuters and frequent travelers | athletes and gym-goers | wireless convenience seekers,wired-only; not ideal for users wanting wireless freedom,niche,5
B0C72D4J46,occiam Wireless Earbuds Bluetooth Headphones 48H Play Back Earphones in Ear Waterproof with Microphone LED Display for Sports Running Workout Pink,occiam,headphones,20,46903,4.3,25.49,generally positive,high,"LED Power Display for Charging Case: the wireless Bluetooth headphones' charging case features an LED power display that shows the remaining power in percentage. The charging case displays its battery level from 1% to 100%. While charging the right or left wireless ear buds earbuds Bluetooth, the LED bars for the earbud on the case will flash. Once the earbuds wireless Bluetooth are fully charged, the LED bars will no longer flash.Convenient to know the charging status of your wireless earbuds. | 48 Hours Battery Life with Charging Case: The built-in 600mAh charging case provides a total of 48 hours of battery life. Each sport Bluetooth wireles earphone can last for 8 hours of music time on a single 1.5-hour charge.The charging case can recharge the twin Bluetooth wireless sports earbuds up to 6 times, resulting in a total playtime of 48 hours when using the portable charging case.You can enjoy uninterrupted music with wireless Bluetooth headphones during your workouts. | Stereo Music & Clear Call: With audio technology, Bluetooth wireless earbuds produce rich, immersive sound with deep bass and clear treble.The true wireless earbuds feature noise-canceling calls, effectively reducing partial background noise, guaranteeing a stable signal and minimal power usage during phone calls.Experience immersive stereo sound and enjoy hands-free calls while working out, wirelessly and effortlessly. | One-Step Auto Pairing: Simply pick up Bluetooth earbuds wireless from the charging case, and they will power on and automatically pair with each other.Then activate Bluetooth function on your mobile phone and search for ""T17"" to connect. After the initial successful connection,the earbuds wireless Bluetooth will automatically connect to the last paired device upon reboot.When using a single earbud wireless, just remove the second one to seamlessly transition between single mode and twin mode.",some complaints about build quality or value for money,commuters and frequent travelers | athletes and gym-goers | wireless convenience seekers,no major segment mismatches reported,niche,5
B09D41HQVZ,KLIM Fusion Earbuds with Microphone - New 2023 - Long-Lasting Wired Ear Buds - Innovative: in-Ear with Memory Foam - Earphones with Mic and 3.5mm Jack - Green,KLIM,headphones,21,43473,4.2,19.97,generally positive,high,"✅ COMFORTABLE. KLIM Fusion are fitted with memory foam which will retain the shape of your ear for a perfect fit. Some people may prefer more standardized in-ear extensions so we're providing 3 additional pairs of all sizes. | ✅ BUILT TO LAST + WARRANTY. There’s a problem with earphones: they often tend to simply stop working after a few months. We prefer to be honest: when it comes to electronics there’s always going to be some defects. We focused on building a product that lasts. 98.5% of earphones are still working after 6 months and 97% still operational after a year. We're confident enough in our product to offer a 5 year warranty, something you’ll find is quite rare for electronics. This is a zero risk purchase. | ✅ HIGH QUALITY AUDIO. You will surely get a higher quality audio output with $100 earphones. But KLIM Fusion offers the absolute best sound quality for its price range, if you want high quality audio at an affordable price, you won’t get better value for your money anywhere else. Enjoy your music without breaking the bank | ✅ MEMORY FOAM. It’s innovative, these in ear extensions have a two fold advantage 1) they’re extremely comfortable and fit your ears perfectly and 2) they completely block out outside noise. Once they’re in your ears, it’s just you and your music.",some complaints about build quality or value for money,commuters and frequent travelers | gamers | budget-conscious buyers,wired-only; not ideal for users wanting wireless freedom | may lack durability or advanced features for demanding users,niche,5
B08BG7J2MN,Aftershokz Aeropex Mini (Rebranded as Shokz OpenRun Mini) Bone Conduction Wireless Bluetooth Headphones,Aftershokz,headphones,22,43149,4.6,169.95,overwhelmingly positive,very high,"Rebranding Update - Aftershokz Aeropex has been renamed as Shokz OpenRun. Welcome to SHOKZ! | Open-Ear Design - Patented bone conduction technology delivers premium audio through the cheekbone, keeping you connected and aware of your surroundings. | Light & Comfortable - Experience unmatched comfort with our most lightweight and comfortable headphones. Aeropex Mini features a 0.5 inch smaller band for a more snug fit. | Eight-Hours of Music & Calls - Enjoy 8 continuous hours of music and dual noise-canceling mics for crystal clear calls.",minor complaints about fit or durability,commuters and frequent travelers | athletes and gym-goers | wireless convenience seekers,no major segment mismatches reported,niche,6
