asin,title,brand,category,popularity_rank,rating_count,average_rating,price,overall_sentiment,positive_feedback_ratio,key_positive_features,common_complaints,best_fit_segments,poor_fit_segments,review_volume_category,feature_count
B01G8JO5F2,"Senso Bluetooth Headphones, Best Wireless Sports Earbuds w/Mic IPX7 Waterproof HD Stereo Sweatproof Earphones for Gym Running Workout Noise Cancelling Earphones Earbuds Noise Cancelling Headsets",Senso,headphones,23,42824,4.1,24.96,generally positive,high,True HD high Fidelity sound featuring latest Bluetooth 4.1 CSR technology and state of the art acoustic components that produce incredible sound quality with deep bass and crystal clear treble. | Comfortable and secure fit with IPX-7 waterproof rating - activbuds feature ergonomically designed flexible ear hooks with gel Flex silicone earbuds to ensure your headphones stay comfortably firm in place to guarantee fatigue free ears and tangle free comfort. | Longest battery life - the new and improved Lithium polymer battery allows seamless enjoyment of music for up to 8 hours and 240 hours stand-by with a quick charge of only 1.5 hours. | Bluetooth V4.1 wireless technology with CVC 6.0 noise suppression technology - connect seamlessly with all Bluetooth enabled devices up to 30 feet away. With noise suppression technology focus on your favorite music and answer calls without skips or missed words.,some complaints about build quality or value for money,commuters and frequent travelers | athletes and gym-goers | wireless convenience seekers,may lack durability or advanced features for demanding users,niche,5
B09YVBSB87,Skullcandy Sesh True Wireless In-Ear Earbuds - Black,Skullcandy,headphones,24,41627,4.1,46.53,generally positive,high,"Bluetooth wireless technology.Note : If the size of the earbud tips does not match the size of your ear canals or the headset is not worn properly in your ears, you may not obtain the correct sound qualities or call performance. Change the earbud tips to ones that fit more snugly in your ears | Product Note : If the size of the earbud tips does not match the size of your ear canals or the headset is not worn properly in your ears, you may not obtain the correct sound qualities or call performance. Change the earbud tips to ones that fit more snugly in your ears | 10 hours of total battery | IP55 sweat, water, and dust resistant.Bluetooth version 5.0.Note:If you face issue in Bluetooth connectivity please turn off the Bluetooth function for a couple of minutes, then turn it back on",some complaints about build quality or value for money,commuters and frequent travelers | athletes and gym-goers | wireless convenience seekers,no major segment mismatches reported,niche,6
B0B62FJF1J,"Bose SoundSport, Wireless Earbuds, (Sweatproof Bluetooth Headphones for Running and Sports), Black",Bose,headphones,25,39355,4.4,149.0,generally positive,high,"Note : If the size of the earbud tips does not match the size of your ear canals or the headset is not worn properly in your ears, you may not obtain the correct sound qualities or call performance. Change the earbud tips to ones that fit more snugly in your ears",some complaints about build quality or value for money,commuters and frequent travelers | athletes and gym-goers | wireless convenience seekers,no major segment mismatches reported,niche,1
B074F3YW3R,"Bose SoundSport Free, True Wireless Earbuds, (Sweatproof Bluetooth Headphones for Workouts and Sports), Midnight Blue / Citron",Bose,headphones,26,39305,4.3,222.93,generally positive,high,"Truly wireless sport headphones for total freedom of movement, packed full of technology that makes music sound clear and powerful. Charging time 2 hours | Earbuds are sweat and weather resistant (with an IPX4 rating) and come with 3 different pairs of StayHear and Sport tips (in sizes S/M/L) that provide a comfortable and secure fit | Up to 5 hours of play time with each charge and an additional 10 hours with the included charging case | Track lost earbuds with the Bose Connect App's “Find My Buds” feature",some complaints about build quality or value for money,athletes and gym-goers | wireless convenience seekers | premium audio enthusiasts,no major segment mismatches reported,long_tail,7
B0BZ49NHW2,"LUDOS Clamor Wired Earbuds in Ear, Noise Isolating Headphones with Microphone, 3.5mm Jack Plug, Mic and Volume Control, Memory Foam, Deep Bass, Tangle-Free Cord - Purple",LUDOS,headphones,27,37573,4.3,19.97,generally positive,high,"🎵Standard Plug: Our earbuds wired support new generation iPhones via lightning adapters, iPhone 5 and 6, iPad Mini/Air, Samsung S8/S9/S10, Galaxy M02s/F02s, M62/F62, A32/A52/A72, Note 8/9/10, iPod touch, true value ear phones with a 3.5 mm jack. The cable is 4.2ft/1.3m long | 🎵 Ergonomic Memory Foam Tips: The tips of our noise isolating ear buds wired have 40% higher wear resistance and adapt to users’ ears to stay snugly in place; earphones wired comes with three pairs of replacement silicone tips | 🎵 Rich Audio with Mic and Call Receiver: Our metal wired ear buds with microphone offer optimal audio quality with powerful bass and the ideal balance of mids and treble; the three-button remote further allow volume control and call receiving/ending | 🎵 Silicone Tips, Pouch, and Ebook Included: Three pairs of replacement tips, a carry case, and an E-book guide come with the purchase of our ear buds with microphone wired; our representatives are available 24/7 to further assist customers",some complaints about build quality or value for money,commuters and frequent travelers | budget-conscious buyers,wired-only; not ideal for users wanting wireless freedom | may lack durability or advanced features for demanding users,long_tail,5
B0787KLT56,Kids Headphones - noot products K11 Foldable Stereo Tangle-Free 3.5mm Jack Wired Cord On-Ear Headset for Children/Teens/Boys/Girls/Smartphones/School/Kindle/Airplane Travel/Plane/Tablet (Navy/Teal),Noot products,headphones,28,36459,4.7,16.99,overwhelmingly positive,very high,"On-ear headphones has padded soft cushions with a soft touch finish. Adjustable headband for a perfect fit, and a lightweight design for kids age 3 and up. Foldable design for a more compact and easy storage. The cord is a 5 feet long nylon braided cable. Designed for kids, girls, boys, children, toddlers, home/online school, training. | 24-Month Hassle-Free Warranty, Easy to Reach Customer Service. | There is NO microphone, remote or volume control on these headphones but you can still speak into the device's mic that you are plugged into. The receiving end will hear you through the device mic's. | Compatible with all smartphones, Chromebooks, iPads, tablets, computers, laptops and all 3.5mm audiojack devices. For iPhone 7 and above, iPad Pro 11 and 12.9 year 2020 models, you will need a lightning to 3.5mm jack adapter.",minor complaints about fit or durability,budget-conscious buyers,wired-only; not ideal for users wanting wireless freedom | may lack durability or advanced features for demanding users,long_tail,4
B08CGJ721T,"JBL Tune 125TWS True Wireless In-Ear Headphones - Pure Bass Sound, 32H Battery, Bluetooth, Fast Pair, Comfortable, Wireless Calls, Music, Native Voice Assistant (White)",JBL,headphones,29,33434,4.3,49.95,generally positive,high,"JBL PURE BASS SOUND: JBL has powered festivals and concerts around the world for decades. Now let JBL bring your own world to life with incredible Pure Bass sound in these wireless earphones | Product Note : If the size of the earbud tips does not match the size of your ear canals or the headset is not worn properly in your ears, you may not obtain the correct sound qualities or call performance. Change the earbud tips to ones that fit more snugly in your ears | UP TO 32 HOURS BATTERY (8H IN THE EARBUDS PLUS 24H IN THE CASE): You can listen to these earbuds all day and all night and get a top up with just 15-minute charge. Keep your own private concert going for as long as you can keep up | FAST PAIR ENABLED BY GOOGLE: As soon as you take your earbuds out of the case, they are paired to your Android device in a single tap. After pairing, any other device can be detected even when not paired",some complaints about build quality or value for money,commuters and frequent travelers | wireless convenience seekers,no major segment mismatches reported,long_tail,6
B095J3HLGN,JBL Tune 510BT: Wireless On-Ear Headphones with Purebass Sound - Black,JBL,headphones,30,32038,4.6,49.95,overwhelmingly positive,very high,"The Tune 510BT wireless headphones feature renowned JBL Pure Bass sound, which can be found in the most famous venues all around the world. | With Wireless Bluetooth 5.0 Streaming, you can stream wirelessly from your device and even switch between two devices so that you don't miss a call. Dynamic frequency response range (Hz) 20 Hz – 20 kHz | For long-lasting fun, listen wirelessly for up to 40 hours and recharge the battery in as little as 2 hours with the convenient Type-C USB cable. A quick 5-minute recharge gives you 2 additional hours of music. | Easily control your sound and manage your calls from your headphones with the convenient buttons on the ear-cup..Note:If you face issue in Bluetooth connectivity please turn off the Bluetooth function for a couple of minutes, then turn it back on",minor complaints about fit or durability,wireless convenience seekers,no major segment mismatches reported,long_tail,6
